[
  {
    "id": "minghong",
    "name": "明汯投资",
    "nameEn": "MH Investments",
    "ticker": "",
    "ind1": "金融科技",
    "ind2": "量化投资",
    "scores": {
      "cashFlow": 90,
      "profitability": 95,
      "debt": 90,
      "operations": 81,
      "sustainability": 83
    },
    "total": 89,
    "grade": "Excellent",
    "gradeLabel": "优秀",
    "oneLine": "量化四天王之一，人均创利2500万+，量化监管收紧+人才单飞是隐忧",
    "report": "明汯投资-财务健康评估-2026-06-12.md",
    "radar": "MHInvestments_health_radar.png",
    "employees": "~100",
    "revenue": "¥33-41亿（2025，估）"
  },
  {
    "id": "hengrui",
    "name": "恒瑞医药",
    "nameEn": "Hengrui Medicine",
    "ticker": "600276.SH / 01276.HK",
    "ind1": "生物医药",
    "ind2": "综合制药",
    "scores": {
      "cashFlow": 90,
      "profitability": 86,
      "debt": 95,
      "operations": 90,
      "sustainability": 83
    },
    "total": 89,
    "grade": "Excellent",
    "gradeLabel": "优秀",
    "oneLine": "中国制药龙头，零负债410亿现金，24款创新药，FDA是唯一短板",
    "report": "恒瑞医药-财务健康评估-2026-06-12.md",
    "radar": "hengrui_health_radar.png",
    "employees": "20,602",
    "revenue": "¥316.29亿（2025）"
  },
  {
    "id": "taptap",
    "name": "TapTap / 心动公司",
    "nameEn": "TapTap",
    "ticker": "2400.HK",
    "ind1": "互动娱乐",
    "ind2": "游戏平台",
    "scores": {
      "cashFlow": 90,
      "profitability": 91,
      "debt": 95,
      "operations": 72,
      "sustainability": 76
    },
    "total": 88,
    "grade": "Excellent",
    "gradeLabel": "优秀",
    "oneLine": "零负债高现金，游戏+社区双轮驱动",
    "report": "TapTap-财务健康评估-2026-06-12.md",
    "radar": "TapTap_health_radar.png",
    "employees": "1,600",
    "revenue": "¥57.6亿（2025）"
  },
  {
    "id": "delta",
    "name": "台达电子",
    "nameEn": "Delta Electronics",
    "ticker": "2308.TW",
    "ind1": "科技硬件",
    "ind2": "电源管理与热管理",
    "scores": {
      "cashFlow": 90,
      "profitability": 83,
      "debt": 83,
      "operations": 81,
      "sustainability": 83
    },
    "total": 86,
    "grade": "Excellent",
    "gradeLabel": "优秀",
    "oneLine": "全球电源#1+零有息负债+AI数据中心需求爆发，中国大陆产能外迁是唯一隐忧",
    "report": "台达电子-财务健康评估-2026-06-22.md",
    "radar": "Delta_health_radar.png",
    "employees": "~80,000+",
    "revenue": "NT$5,549亿（FY2025）"
  },
  {
    "id": "dena",
    "name": "DeNA",
    "nameEn": "DeNA Co., Ltd.",
    "ticker": "2432.T",
    "ind1": "互动娱乐",
    "ind2": "游戏研发",
    "scores": {
      "cashFlow": 90,
      "profitability": 64,
      "debt": 90,
      "operations": 73,
      "sustainability": 76
    },
    "total": 82,
    "grade": "Moderate-High",
    "gradeLabel": "中等偏上",
    "oneLine": "Pokemon TCG Pocket首年$13亿+净现金¥546亿，爆款后遗症MAU腰斩+CEO一年两换+医疗减值",
    "report": "DeNA-财务健康评估-2026-06-18.md",
    "radar": "DeNA_health_radar.png",
    "employees": "2,572",
    "revenue": "¥1,477亿（FY2025）"
  },
  {
    "id": "evatmaster",
    "name": "欧税通",
    "nameEn": "eVat Master",
    "ticker": "",
    "ind1": "企业服务",
    "ind2": "财税SaaS",
    "scores": {
      "cashFlow": 90,
      "profitability": 86,
      "debt": 95,
      "operations": 90,
      "sustainability": 61
    },
    "total": 87,
    "grade": "Excellent",
    "gradeLabel": "优秀",
    "oneLine": "跨境合规SaaS龙头，财务不透明",
    "report": "欧税通-财务健康评估-2026-06-12.md",
    "radar": "欧税通_eVatMaster_health_radar.png",
    "employees": "~300",
    "revenue": "未披露"
  },
  {
    "id": "xiaohongshu",
    "name": "小红书",
    "nameEn": "Xiaohongshu",
    "ticker": "",
    "ind1": "互联网平台",
    "ind2": "社交媒体与内容",
    "scores": {
      "cashFlow": 90,
      "profitability": 90,
      "debt": 76,
      "operations": 90,
      "sustainability": 83
    },
    "total": 87,
    "grade": "Excellent",
    "gradeLabel": "优秀",
    "oneLine": "人均产出行业第一，零负债高利润，监管合规是核心隐忧",
    "report": "小红书-财务健康评估-2026-06-12.md",
    "radar": "Xiaohongshu_health_radar.png",
    "employees": "~4,000",
    "revenue": "~¥420亿（2025，估）"
  },
  {
    "id": "antgroup",
    "name": "蚂蚁集团",
    "nameEn": "Ant Group",
    "ticker": "",
    "ind1": "金融科技",
    "ind2": "综合金融科技",
    "scores": {
      "cashFlow": 90,
      "profitability": 91,
      "debt": 76,
      "operations": 90,
      "sustainability": 76
    },
    "total": 87,
    "grade": "Excellent",
    "gradeLabel": "优秀",
    "oneLine": "现金2,800亿+净利润强劲反弹，AI全面转型，金控牌照未获批是最大悬案",
    "report": "蚂蚁集团-财务健康评估-2026-06-12.md",
    "radar": "AntGroup_health_radar.png",
    "employees": "3.7万",
    "revenue": "~¥2,100亿（2024，估）"
  },
  {
    "id": "hypergryph",
    "name": "鹰角网络",
    "nameEn": "Hypergryph",
    "ticker": "",
    "ind1": "互动娱乐",
    "ind2": "游戏研发",
    "scores": {
      "cashFlow": 90,
      "profitability": 77,
      "debt": 95,
      "operations": 90,
      "sustainability": 69
    },
    "total": 86,
    "grade": "Excellent",
    "gradeLabel": "优秀",
    "oneLine": "零负债+终末地两周12亿流水，单IP依赖与行业收缩是隐忧",
    "report": "鹰角网络-财务健康评估-2026-06-14.md",
    "radar": "hypergryph_health_radar.png",
    "employees": "~1,700",
    "revenue": "~¥30亿（2024）+终末地¥12.5亿两周（2026.1）"
  },
  {
    "id": "caper",
    "name": "Caper (Instacart)",
    "nameEn": "Caper (Instacart)",
    "ticker": "NASDAQ: CART",
    "ind1": "科技硬件",
    "ind2": "智能零售",
    "scores": {
      "cashFlow": 90,
      "profitability": 87,
      "debt": 90,
      "operations": 64,
      "sustainability": 83
    },
    "total": 86,
    "grade": "Excellent",
    "gradeLabel": "优秀",
    "oneLine": "零负债$8.8B现金+OCF 2.17x覆盖净利润，客户集中+高管批量流失是隐忧",
    "report": "Caper-财务健康评估-2026-06-17.md",
    "radar": "Caper_health_radar.png",
    "employees": "~3,300 (Instacart)",
    "revenue": "$37.42亿（Instacart FY2025）"
  },
  {
    "id": "kingsoftoffice",
    "name": "金山办公",
    "nameEn": "Kingsoft Office",
    "ticker": "688111.SH",
    "ind1": "企业服务",
    "ind2": "办公软件",
    "scores": {
      "cashFlow": 90,
      "profitability": 84,
      "debt": 90,
      "operations": 72,
      "sustainability": 72
    },
    "total": 85,
    "grade": "Excellent",
    "gradeLabel": "优秀",
    "oneLine": "毛利率86%+零负债+中国唯一盈利上市办公软件，C端见顶+AI变现未验证",
    "report": "金山办公-财务健康评估-2026-06-12.md",
    "radar": "KingsoftOffice_health_radar.png",
    "employees": "~6,048",
    "revenue": "¥59.29亿（2025）"
  },
  {
    "id": "pdd",
    "name": "拼多多",
    "nameEn": "PDD Holdings",
    "ticker": "NASDAQ: PDD",
    "ind1": "互联网平台",
    "ind2": "电商",
    "scores": {
      "cashFlow": 90,
      "profitability": 84,
      "debt": 90,
      "operations": 90,
      "sustainability": 52
    },
    "total": 85,
    "grade": "Excellent",
    "gradeLabel": "优秀",
    "oneLine": "净现金¥4,169亿+人效全球顶级，增速90%→10%+中概股最大未回港风险",
    "report": "拼多多-财务健康评估-2026-06-12.md",
    "radar": "PDD_health_radar.png",
    "employees": "25,474",
    "revenue": "¥4,318亿（2025）"
  },
  {
    "id": "iauto",
    "name": "商泰汽车 iAUTO",
    "nameEn": "iAUTO",
    "ticker": "",
    "ind1": "汽车科技",
    "ind2": "汽车软件",
    "scores": {
      "cashFlow": 90,
      "profitability": 87,
      "debt": 95,
      "operations": 62,
      "sustainability": 69
    },
    "total": 85,
    "grade": "Excellent",
    "gradeLabel": "优秀",
    "oneLine": "小而稳的车载软件供应商，零负债",
    "report": "商泰汽车-iAUTO-财务健康评估-2026-06-12.md",
    "radar": "iAUTO_health_radar.png",
    "employees": "474",
    "revenue": "~¥3-5亿（估）"
  },
  {
    "id": "mihoyo",
    "name": "米哈游",
    "nameEn": "miHoYo",
    "ticker": "",
    "ind1": "互动娱乐",
    "ind2": "游戏研发",
    "scores": {
      "cashFlow": 90,
      "profitability": 84,
      "debt": 90,
      "operations": 72,
      "sustainability": 72
    },
    "total": 85,
    "grade": "Excellent",
    "gradeLabel": "优秀",
    "oneLine": "零负债+59%净利率+人均创利行业第一，千亿AI赌注",
    "report": "米哈游-财务健康评估-2026-06-12.md",
    "radar": "miHoYo_health_radar.png",
    "employees": "~7,500",
    "revenue": "~¥350-400亿（2025，估）"
  },
  {
    "id": "innoventbio",
    "name": "信达生物",
    "nameEn": "Innovent Biologics",
    "ticker": "01801.HK",
    "ind1": "生物医药",
    "ind2": "综合制药",
    "scores": {
      "cashFlow": 90,
      "profitability": 91,
      "debt": 69,
      "operations": 81,
      "sustainability": 83
    },
    "total": 85,
    "grade": "Excellent",
    "gradeLabel": "优秀",
    "oneLine": "18款产品+243亿现金+首次全面盈利+BD超220亿美元，集采风险是核心隐忧",
    "report": "信达生物-财务健康评估-2026-06-12.md",
    "radar": "信达生物_health_radar.png",
    "employees": "7,502",
    "revenue": "¥130.42亿（2025）"
  },
  {
    "id": "nebius",
    "name": "Nebius",
    "nameEn": "Nebius Group",
    "ticker": "NASDAQ: NBIS",
    "ind1": "人工智能",
    "ind2": "AI基础设施",
    "scores": {
      "cashFlow": 90,
      "profitability": 79,
      "debt": 90,
      "operations": 71,
      "sustainability": 83
    },
    "total": 85,
    "grade": "Excellent",
    "gradeLabel": "优秀",
    "oneLine": "Yandex凤凰涅槃的欧洲GPU云新贵，$9.3B现金+OCF $2.3B+$460亿积压，客户集中+内部人抛售是隐忧",
    "report": "Nebius-财务健康评估-2026-06-17.md",
    "radar": "Nebius_health_radar.png",
    "employees": "1,500",
    "revenue": "$5.3亿（FY2025）→ Q1 2026 $3.99亿"
  },
  {
    "id": "transsion",
    "name": "传音控股",
    "nameEn": "Transsion Holdings",
    "ticker": "688036.SH",
    "ind1": "科技硬件",
    "ind2": "手机与智能终端",
    "scores": {
      "cashFlow": 81,
      "profitability": 60,
      "debt": 69,
      "operations": 90,
      "sustainability": 69
    },
    "total": 75,
    "grade": "Moderate-High",
    "gradeLabel": "中等偏上",
    "oneLine": "非洲手机之王利润腰斩后强势修复，Q1 +43%，汇率裸奔+专利围剿+存储涨价三重暴击",
    "report": "Transsion-财务健康评估-2026-06-17.md",
    "radar": "Transsion_health_radar.png",
    "employees": "24,025",
    "revenue": "¥655.91亿（FY2025）→ Q1 2026 ¥162亿"
  },
  {
    "id": "shanghai9th",
    "name": "上海第九人民医院",
    "nameEn": "Shanghai Ninth People's Hospital",
    "ticker": "",
    "ind1": "生物医药",
    "ind2": "医疗机构",
    "scores": {
      "cashFlow": 81,
      "profitability": 70,
      "debt": 90,
      "operations": 90,
      "sustainability": 83
    },
    "total": 81,
    "grade": "Moderate-High",
    "gradeLabel": "中等偏上",
    "oneLine": "整形#1+口腔#3=中国医学界金字招牌，DRG降薪+编制门槛+过劳是硬伤",
    "report": "上海九院-雇主评估-2026-06-14.md",
    "radar": "shanghai_ninth_hospital_health_radar.png",